{
  "contractVersion": 1,
  "kind": "theme",
  "id": "theme_crimson_ops",
  "name": "Crimson Ops",
  "price": 2000,
  "description": "Black ops HUD: red alert, white text, sharp corners.",
  "tokens": {
    "--bg": "#070506",
    "--bg-glow-1": "rgba(239, 68, 68, 0.16)",
    "--bg-glow-2": "rgba(244, 63, 94, 0.08)",
    "--violet": "#ef4444",
    "--violet-soft": "#fca5a5",
    "--cyan": "#f8fafc",
    "--accent-grad": "linear-gradient(135deg, #b91c1c 0%, #f43f5e 100%)",
    "--surface": "rgba(28, 16, 18, 0.66)",
    "--surface-2": "rgba(40, 22, 26, 0.76)",
    "--surface-hover": "rgba(56, 30, 36, 0.82)",
    "--border": "rgba(252, 165, 165, 0.10)",
    "--border-strong": "rgba(252, 165, 165, 0.24)",
    "--radius-lg": "6px",
    "--radius": "4px",
    "--radius-sm": "3px",
    "--glow-violet": "0 0 24px rgba(239, 68, 68, 0.35)"
  }
}
