{
  "contractVersion": 1,
  "kind": "theme",
  "id": "theme_solar",
  "name": "Solar Forge",
  "price": 800,
  "description": "Warm amber steel, like a forge at night.",
  "tokens": {
    "--bg": "#0d0905",
    "--bg-glow-1": "rgba(249, 115, 22, 0.18)",
    "--bg-glow-2": "rgba(234, 179, 8, 0.10)",
    "--violet": "#f97316",
    "--violet-soft": "#fdba74",
    "--cyan": "#facc15",
    "--accent-grad": "linear-gradient(135deg, #ea580c 0%, #facc15 100%)",
    "--surface": "rgba(36, 24, 14, 0.62)",
    "--surface-2": "rgba(50, 34, 20, 0.72)",
    "--surface-hover": "rgba(66, 46, 28, 0.8)",
    "--border": "rgba(253, 186, 116, 0.10)",
    "--border-strong": "rgba(253, 186, 116, 0.22)",
    "--glow-violet": "0 0 24px rgba(249, 115, 22, 0.35)",
    "--font-display": "'Inter Variable', system-ui, sans-serif"
  }
}
